{
  "schema": 1,
  "version": "0.1.0",
  "commit_sha": "0123456789abcdef0123456789abcdef01234567",
  "package_sha256": "0000000000000000000000000000000000000000000000000000000000000000",
  "workflow_paths": [
    ".github/workflows/pr-review.yml",
    ".github/workflows/issue-triage.yml",
    ".github/workflows/agent.yml"
  ],
  "provenance": {
    "source": "Loopkeeper release pipeline",
    "builder": "GitHub Actions",
    "note": "The release job replaces commit and package digests with values from the immutable build."
  }
}
